"Key","Item Type","Publication Year","Author","Title","Publication Title","ISBN","ISSN","DOI","Url","Abstract Note","Date","Date Added","Date Modified","Access Date","Pages","Num Pages","Issue","Volume","Number Of Volumes","Journal Abbreviation","Short Title","Series","Series Number","Series Text","Series Title","Publisher","Place","Language","Rights","Type","Archive","Archive Location","Library Catalog","Call Number","Extra","Notes","File Attachments","Link Attachments","Manual Tags","Automatic Tags","Editor","Series Editor","Translator","Contributor","Attorney Agent","Book Author","Cast Member","Commenter","Composer","Cosponsor","Counsel","Interviewer","Producer","Recipient","Reviewed Author","Scriptwriter","Words By","Guest","Number","Edition","Running Time","Scale","Medium","Artwork Size","Filing Date","Application Number","Assignee","Issuing Authority","Country","Meeting Name","Conference Name","Court","References","Reporter","Legal Status","Priority Numbers","Programming Language","Version","System","Code","Code Number","Section","Session","Committee","History","Legislative Body"
"6T987YVH","journalArticle","2015","Head, Megan L.; Holman, Luke; Lanfear, Rob; Kahn, Andrew T.; Jennions, Michael D.","The Extent and Consequences of P-Hacking in Science","PLOS Biology","","1545-7885","10.1371/journal.pbio.1002106","https://journals.plos.org/plosbiology/article?id=10.1371/journal.pbio.1002106","A focus on novel, confirmatory, and statistically significant results leads to substantial bias in the scientific literature. One type of bias, known as “p-hacking,” occurs when researchers collect or select data or statistical analyses until nonsignificant results become significant. Here, we use text-mining to demonstrate that p-hacking is widespread throughout science. We then illustrate how one can test for p-hacking when performing a meta-analysis and show that, while p-hacking is probably common, its effect seems to be weak relative to the real effect sizes being measured. This result suggests that p-hacking probably does not drastically alter scientific consensuses drawn from meta-analyses.","2015-03-13","2020-06-15 14:41:01","2020-06-15 14:41:01","2020-06-15 14:41:01","e1002106","","3","13","","PLOS Biology","","","","","","","","en","","","","","PLoS Journals","","Publisher: Public Library of Science","","C:\Users\hmosh\Zotero\storage\4MW85WG6\article.html; C:\Users\hmosh\Zotero\storage\63ID2MB6\Head et al. - 2015 - The Extent and Consequences of P-Hacking in Scienc.pdf","","","Binomials; Medicine and health sciences; Meta-analysis; Psychology; Publication ethics; Research validity; Statistical data; Test statistics","","","","","","","","","","","","","","","","","","","","","","","","","","","","","","","","","","","","","","","","","","","","","",""
"FDXJ6QBL","journalArticle","2012","John, Leslie K.; Loewenstein, George; Prelec, Drazen","Measuring the Prevalence of Questionable Research Practices With Incentives for Truth Telling","Psychological Science","","0956-7976","10.1177/0956797611430953","https://doi.org/10.1177/0956797611430953","Cases of clear scientific misconduct have received significant media attention recently, but less flagrantly questionable research practices may be more prevalent and, ultimately, more damaging to the academic enterprise. Using an anonymous elicitation format supplemented by incentives for honest reporting, we surveyed over 2,000 psychologists about their involvement in questionable research practices. The impact of truth-telling incentives on self-admissions of questionable research practices was positive, and this impact was greater for practices that respondents judged to be less defensible. Combining three different estimation methods, we found that the percentage of respondents who have engaged in questionable practices was surprisingly high. This finding suggests that some questionable practices may constitute the prevailing research norm.","2012-05-01","2020-06-10 21:06:31","2020-06-10 21:06:31","2020-06-10 21:06:31","524-532","","5","23","","Psychol Sci","","","","","","","","en","","","","","SAGE Journals","","Publisher: SAGE Publications Inc","","C:\Users\hmosh\Zotero\storage\UGN8K4IX\John et al. - 2012 - Measuring the Prevalence of Questionable Research .pdf","","","","","","","","","","","","","","","","","","","","","","","","","","","","","","","","","","","","","","","","","","","","","","","","",""
"P5TVQVK5","journalArticle","2005","Broome, Marion E.; Pryor, Erica; Habermann, Barbara; Pulley, Leavonne; Kincaid, Harold","The Scientific Misconduct Questionnaire—Revised (SMQ-R): Validation and Psychometric Testing","Accountability in Research","","0898-9621, 1545-5815","10.1080/08989620500440253","https://www.tandfonline.com/doi/full/10.1080/08989620500440253","","2005-10","2020-06-10 20:55:20","2020-06-10 20:55:20","2020-06-10 20:55:20","263-280","","4","12","","Accountability in Research","The Scientific Misconduct Questionnaire—Revised (SMQ-R)","","","","","","","en","","","","","DOI.org (Crossref)","","","<p>Provides an initial questionnaire development and factor analysis with some known-groups analysis for validation.</p> <p>Means of individual items could be interesting.</p> <p>p276: ""Just over one-fifth (21.5%, n = 334) of all respondents indicated that they had first-hand knowledge of an occurrence of scientific misconduct. An in-depth qualitative analysis of these data is on-going, and beyond the scope of this paper, but will be reported elsewhere."" </p>","C:\Users\hmosh\Zotero\storage\LDH9LFWK\Broome et al. - 2005 - The Scientific Misconduct Questionnaire—Revised (S.pdf","","","","","","","","","","","","","","","","","","","","","","","","","","","","","","","","","","","","","","","","","","","","","","","","",""
"K4QU4SFY","journalArticle","2019","Beaudry, Jennifer L.; Kaufman, Jordy; Johnstone, Tom; Given, Lisa","Open Science Survey","","","","10.17605/OSF.IO/BK8Y7","https://osf.io/bk8y7/","University-wide survey of open science practices, attitudes, & barriers (10-25 min to complete)      Hosted on the Open Science Framework","2019-10-25","2020-07-27 15:07:41","2020-07-27 15:07:41","2020-07-08 09:55:34","","","","","","","","","","","","","","en","","","","","osf.io","","Publisher: OSF","","","","","","","","","","","","","","","","","","","","","","","","","","","","","","","","","","","","","","","","","","","","","","","","","","",""
"KSY6MR2S","journalArticle","2016","Kim, Youngseek; Stanton, Jeffrey M.","Institutional and individual factors affecting scientists' data-sharing behaviors: A multilevel analysis","Journal of the Association for Information Science and Technology","","23301635","10.1002/asi.23424","http://doi.wiley.com/10.1002/asi.23424","","2016-04","2020-07-27 15:07:39","2020-07-27 15:07:39","2020-07-07 15:14:36","776-799","","4","67","","J Assn Inf Sci Tec","Institutional and individual factors affecting scientists' data-sharing behaviors","","","","","","","en","","","","","DOI.org (Crossref)","","","","","","","","","","","","","","","","","","","","","","","","","","","","","","","","","","","","","","","","","","","","","","","","","","","","",""
"J2XS7P7K","journalArticle","2012","Kim, Youngseek","Factors influencing STEM researchers' data sharing behaviors:","Proceedings of the American Society for Information Science and Technology","","00447870","10.1002/meet.14504901348","http://doi.wiley.com/10.1002/meet.14504901348","","2012","2020-07-27 15:07:38","2020-07-27 15:07:38","2020-07-07 15:17:54","1-5","","1","49","","Proc. Am. Soc. Info. Sci. Tech.","Factors influencing STEM researchers' data sharing behaviors","","","","","","","en","","","","","DOI.org (Crossref)","","","","","","","","","","","","","","","","","","","","","","","","","","","","","","","","","","","","","","","","","","","","","","","","","","","","",""
"6NADAF7K","journalArticle","2017","Linek, Stephanie B.; Fecher, Benedikt; Friesike, Sascha; Hebing, Marcel","Data sharing as social dilemma: Influence of the researcher’s personality","PLOS ONE","","1932-6203","10.1371/journal.pone.0183216","https://journals.plos.org/plosone/article?id=10.1371/journal.pone.0183216","It is widely acknowledged that data sharing has great potential for scientific progress. However, so far making data available has little impact on a researcher’s reputation. Thus, data sharing can be conceptualized as a social dilemma. In the presented study we investigated the influence of the researcher's personality within the social dilemma of data sharing. The theoretical background was the appropriateness framework. We conducted a survey among 1564 researchers about data sharing, which also included standardized questions on selected personality factors, namely the so-called Big Five, Machiavellianism and social desirability. Using regression analysis, we investigated how these personality domains relate to four groups of dependent variables: attitudes towards data sharing, the importance of factors that might foster or hinder data sharing, the willingness to share data, and actual data sharing. Our analyses showed the predictive value of personality for all four groups of dependent variables. However, there was not a global consistent pattern of influence, but rather different compositions of effects. Our results indicate that the implications of data sharing are dependent on age, gender, and personality. In order to foster data sharing, it seems advantageous to provide more personal incentives and to address the researchers’ individual responsibility.","2017-08-17","2020-07-27 15:07:36","2020-07-27 15:07:36","2020-07-03 09:53:25","e0183216","","8","12","","PLOS ONE","Data sharing as social dilemma","","","","","","","en","","","","","PLoS Journals","","","","","","","1564 respondents; Germany; open data; personality","","","","","","","","","","","","","","","","","","","","","","","","","","","","","","","","","","","","","","","","","","","","","",""
"KUJDQLV7","journalArticle","2017","Héroux, Martin E.; Loo, Colleen K.; Taylor, Janet L.; Gandevia, Simon C.","Questionable science and reproducibility in electrical brain stimulation research","PLOS ONE","","1932-6203","10.1371/journal.pone.0175635","https://dx.plos.org/10.1371/journal.pone.0175635","","2017-04-26","2020-07-27 15:37:34","2020-07-27 15:37:34","2020-07-27 15:37:33","e0175635","","4","12","","PLoS ONE","","","","","","","","en","","","","","DOI.org (Crossref)","","","","C:\Users\hmosh\Zotero\storage\Q6FG7U3H\Héroux et al. - 2017 - Questionable science and reproducibility in electr.pdf","","","","Wicherts, Jelte M.","","","","","","","","","","","","","","","","","","","","","","","","","","","","","","","","","","","","","","","","","","","","",""
"XVE3DLNM","journalArticle","2020","Swift, Joshua K.; Christopherson, Cody D.; Bird, Megan O.; Zöld, Amanda; Goode, Jonathan","Questionable research practices among faculty and students in APA-accredited clinical and counseling psychology doctoral programs.","Training and Education in Professional Psychology","","1931-3926, 1931-3918","10.1037/tep0000322","http://doi.apa.org/getdoi.cfm?doi=10.1037/tep0000322","","2020-04-27","2020-07-27 16:00:40","2020-07-27 16:00:40","2020-07-27 16:00:40","","","","","","Training and Education in Professional Psychology","","","","","","","","en","","","","","DOI.org (Crossref)","","","","","","","","","","","","","","","","","","","","","","","","","","","","","","","","","","","","","","","","","","","","","","","","","","","","",""
"MGMSBHTX","report","2019","Flake, Jessica Kay; Fried, Eiko I","Measurement Schmeasurement: Questionable Measurement Practices and How to Avoid Them","","","","","https://osf.io/hs7wm","In this paper, we define questionable measurement practices (QMPs) as decisions researchers make that raise doubts about the validity of the measures, and ultimately the validity of study conclusions. Doubts arise for a host of reasons including a lack of transparency, ignorance, negligence, or misrepresentation of the evidence. We describe the scope of the problem and focus on how transparency is a part of the solution. A lack of measurement transparency makes it impossible to evaluate potential threats to internal, external, statistical conclusion, and construct validity. We demonstrate that psychology is plagued by a measurement schmeasurement attitude: QMPs are common, hide a stunning source of researcher degrees of freedom, pose a serious threat to cumulative psychological science, but are largely ignored. We address these challenges by providing a set of questions that researchers and consumers of scientific research can consider to identify and avoid QMPs. Transparent answers to these measurement questions promote rigorous research, allow for thorough evaluations of a study’s inferences, and are necessary for meaningful replication studies.","2019-01-17","2020-07-27 16:13:58","2020-07-27 16:13:58","2020-07-27 16:13:58","","","","","","","Measurement Schmeasurement","","","","","PsyArXiv","","","","preprint","","","DOI.org (Crossref)","","DOI: 10.31234/osf.io/hs7wm","","C:\Users\hmosh\Zotero\storage\UHVKL2YT\Flake and Fried - 2019 - Measurement Schmeasurement Questionable Measureme.pdf","","","","","","","","","","","","","","","","","","","","","","","","","","","","","","","","","","","","","","","","","","","","","","","","",""
"QIF333MD","journalArticle","2018","Fraser, Hannah; Parker, Tim; Nakagawa, Shinichi; Barnett, Ashley; Fidler, Fiona; Wicherts, Jelte M.","Questionable research practices in ecology and evolution","PLoS ONE","","","10.1371/journal.pone.0200303","","","2018","2020-07-27 20:24:59","2020-07-27 20:24:59","","","","7","13","","","","","","","","","","","","","","","","","","","","","","","","","","","","","","","","","","","","","","","","","","","","","","","","","","","","","","","","","","","","","","","","","","","",""
"5AJLAQKJ","journalArticle","2016","Banks, George C.; O’Boyle, Ernest H.; Pollack, Jeffrey M.; White, Charles D.; Batchelor, John H.; Whelpley, Christopher E.; Abston, Kristie A.; Bennett, Andrew A.; Adkins, Cheryl L.","Questions About Questionable Research Practices in the Field of Management: A Guest Commentary","Journal of Management","","0149-2063","10.1177/0149206315619011","https://doi.org/10.1177/0149206315619011","The discussion regarding questionable research practices (QRPs) in management as well as the broader natural and social sciences has increased substantially in recent years. Despite the attention, questions remain regarding research norms and the implications for both theoretical and practical advancements. The aim of the current article is to address these issues in a question-and-answer format while drawing upon both past research and the results of a series of new studies conducted using a mixed-methods design. Our goal is to encourage a systematic, collegial, and constructive dialogue regarding QRPs in management research.","2016-01-01","2020-07-27 20:49:00","2020-07-27 20:49:00","2020-07-27 20:49:00","5-20","","1","42","","Journal of Management","Questions About Questionable Research Practices in the Field of Management","","","","","","","","","","","","SAGE Journals","","Publisher: SAGE Publications Inc","","C:\Users\hmosh\Zotero\storage\YM3N88TQ\Banks et al. - 2016 - Questions About Questionable Research Practices in.pdf","","","","","","","","","","","","","","","","","","","","","","","","","","","","","","","","","","","","","","","","","","","","","","","","",""
"BYWUG67R","webpage","2017","CWTS","Open data report","","","","","https://www.elsevier.com/about/open-science/research-data/open-data-report","Elsevier and CWTS benchmark report on researchers perspectives on data sharing and data sharing practices","2017","2020-07-27 20:57:37","2020-07-27 20:57:37","2020-07-03 11:04:11","","","","","","","","","","","","","","en","","","","","","","Rohdaten https://data.mendeley.com/datasets/bwrnfb4bvh/1","","","","","1162 respondents; open data","","","","","","","","","","","","","","","","","","","","","","","","","","","","","","","","","","","","","","","","","","","","","",""
"MF8WJ9PA","journalArticle","2013","Okonta, Patrick; Rossouw, Theresa","Prevalence of Scientific Misconduct Among a Group of Researchers in Nigeria","Developing World Bioethics","","1471-8847","10.1111/j.1471-8847.2012.00339.x","https://onlinelibrary.wiley.com/doi/abs/10.1111/j.1471-8847.2012.00339.x","Background There is a dearth of information on the prevalence of scientific misconduct from Nigeria. Objectives This study aimed at determining the prevalence of scientific misconduct in a group of researchers in Nigeria. Factors associated with the prevalence were ascertained. Method A descriptive study of researchers who attended a scientific conference in 2010 was conducted using the adapted Scientific Misconduct Questionnaire-Revised (SMQ-R). Results Ninety-one researchers (68.9%) admitted having committed at least one of the eight listed forms of scientific misconduct. Disagreement about authorship was the most common form of misconduct committed (36.4%) while plagiarism was the least (9.2%). About 42% of researchers had committed falsification of data or plagiarism. Analysis of specific acts of misconduct showed that committing plagiarism was inversely associated with years in research (Fisher exact p-value = 0.02); falsifying data was related to perceived low effectiveness of the institution's rules and procedures for reducing scientific misconduct (X2 = 6.44, p-value = 0.01); and succumbing to pressure from study sponsor to engage in unethical practice was related to sex of researcher (Fisher exact p-value = 0.02). Conclusions The emergent data from this study is a cause for serious concern and calls for prompt intervention. The best response to reducing scientific misconduct will proceed from measures that contain both elements of prevention and enforcement. Training on research ethics has to be integrated into the curriculum of undergraduate and postgraduate students while provision should be made for in-service training of researchers. Penalties against acts of scientific misconduct should be enforced at institutional and national levels.","2013","2020-07-27 21:08:17","2020-07-27 21:08:17","2020-07-27 21:08:17","149-157","","3","13","","","","","","","","","","en","© 2012 John Wiley & Sons Ltd","","","","Wiley Online Library","","_eprint: https://onlinelibrary.wiley.com/doi/pdf/10.1111/j.1471-8847.2012.00339.x","","C:\Users\hmosh\Zotero\storage\2CIHACZK\Okonta and Rossouw - 2013 - Prevalence of Scientific Misconduct Among a Group .pdf; C:\Users\hmosh\Zotero\storage\DRKKNP3C\j.1471-8847.2012.00339.html","","","bioethics; clinical; developing world; developing world bioethics; research ethics","","","","","","","","","","","","","","","","","","","","","","","","","","","","","","","","","","","","","","","","","","","","","",""
"DPR4H49A","journalArticle","2013","Ozturk, Naim; Armato, Samuel G.; Giger, Maryellen L.; Serago, Christopher F.; Ross, Lainie F.","Ethics and professionalism in medical physics: A survey of AAPM members","Medical Physics","","0094-2405","10.1118/1.4797463","https://www.ncbi.nlm.nih.gov/pmc/articles/PMC3625237/","Purpose: To assess current education, practices, attitudes, and perceptions pertaining to ethics and professionalism in medical physics., Methods: A link to a web-based survey was distributed to the American Association of Physicists in Medicine (AAPM) e-mail membership list, with a follow-up e-mail sent two weeks later. The survey included questions about ethics/professionalism education, direct personal knowledge of ethically questionable practices in clinical care, research, education (teaching and mentoring), and professionalism, respondents’ assessment of their ability to address ethical/professional dilemmas, and demographics. For analysis, reports of unethical or ethically questionable practices or behaviors by approximately 40% or more of respondents were classified as “frequent.”, Results: Partial or complete responses were received from 18% (1394/7708) of AAPM members. Overall, 60% (827/1377) of the respondents stated that they had not received ethics/professionalism education during their medical physics training. Respondents currently in training were more likely to state that they received instruction in ethics/professionalism (80%, 127/159) versus respondents who were post-training (35%, 401/1159). Respondents’ preferred method of instruction in ethics/professionalism was structured periodic discussions involving both faculty and students/trainees. More than 90% (1271/1384) supported continuing education in ethics/professionalism and 75% (1043/1386) stated they would attend ethics/professionalism sessions at professional/scientific meetings. In the research setting, reports about ethically questionable authorship assignment were frequent (approximately 40%) whereas incidents of ethically questionable practices about human subjects protections were quite infrequent (5%). In the clinical setting, there was frequent recollection of incidents regarding lack of training, resources and skills, and error/incident reporting. In the educational setting, incidents of unethical or ethically questionable practices were only frequently recollected with respect to mentorship/guidance. With respect to professional conduct, favoritism, hostile work/learning environment, and maltreatment of subordinates and colleagues were frequently reported. A significantly larger proportion of women reported experiences with hostile work/learning environments, favoritism, poor mentorship, unfairness in educational settings, and concerns about student privacy and confidentiality., Conclusions: The survey found broad interest in ethics/professionalism topics and revealed that these topics were being integrated into the curriculum at many institutions. The incorporation of ethics and professionalism instruction into both graduate education and postgraduate training of medical physicists, and into their subsequent lifelong continuing education is important given the nontrivial number of medical physicists who had direct personal knowledge of unethical or ethically questionable incidents in clinical practice, research, education, and professionalism.","2013-04","2020-07-31 19:32:57","2020-08-03 19:19:04","2020-08-03 19:18:08","","","4","40","","Med Phys","Ethics and professionalism in medical physics","","","","","","","","","","","","PubMed Central","","tex.ids: ozturkEthicsProfessionalismMedical2013, ozturkEthicsProfessionalismMedical2013a PMCID: PMC3625237 PMID: 23556930","","C:\Users\hmosh\Zotero\storage\ZQHU7SUK\Ozturk et al. - 2013 - Ethics and professionalism in medical physics A s.pdf; ","https://www.ncbi.nlm.nih.gov/pmc/articles/PMC3625237/","medical physics","","","","","","","","","","","","","","","","","","","","","","","","","","","","","","","","","","","","","","","","","","","","","","",""
"WUW92MNK","journalArticle","2015","Hofmann, Bjørn; Helgesson, Gert; Juth, Niklas; Holm, Søren","Scientific Dishonesty: A Survey of Doctoral Students at the Major Medical Faculties in Sweden and Norway","Journal of Empirical Research on Human Research Ethics: An International Journal","","1556-2646","","https://www.jstor.org/stable/90012091","Abstract As we need knowledge about the prevalence of scientific dishonesty, this study investigates the knowledge of, experiences with, and attitudes toward various forms of scientific dishonesty among PhD students at the main medical faculties in Sweden and Norway. An anonymous questionnaire was distributed to all post-graduate research students attending basic PhD courses at the medical faculties in Stockholm and Oslo during the fall 2014. The responding doctoral students reported to know about various forms of scientific dishonesty from the literature, in their department, and for some also through their own experience. Some forms of scientific misconduct were considered to be acceptable by a significant minority. There was a high level of willingness to report misconduct but little awareness of relevant policies for scientific conduct.","2015","2020-07-31 18:56:35","2020-07-31 18:56:43","2020-07-31 18:56:35","380-388","","4","10","","","Scientific Dishonesty","","","","","","","","","","JSTOR","","JSTOR","","Publisher: Sage Publications, Inc.","","","","medicine; norway; sweden","","","","","","","","","","","","","","","","","","","","","","","","","","","","","","","","","","","","","","","","","","","","","","",""
